qid,query
839-3,What are the key components of information collection by the federal government?
839-4,How does the federal government analyze information?
839-5,What methods does the federal government use to deliver information?
839-6,How is information interpreted by federal agencies?
839-7,What is constitutional due process?
839-8,How does constitutional due process protect individuals in the context of government information activities?
839-9,What are the implications of government information activities on individual rights?
839-10,What legal frameworks govern the federal government's information activities?
97-1,What were the key historical events that led to the formation of the Democratic and Republican parties in the United States?
97-2,How have the platforms and ideologies of the Democratic and Republican parties evolved over time?
97-3,"What role do third parties play in the US political system, and how have they influenced the major parties?"
97-4,"How do structural elements, such as electoral systems and campaign finance, shape competition between US political parties?"
97-5,What are the main ideological differences between the Democratic and Republican parties today?
97-6,How do the dynamics of US political parties compare to political parties in other democratic nations?
97-7,What factors contribute to the stability or volatility of party systems in the United States?
97-8,How have demographic changes in the US influenced the evolution of political parties?
97-9,What are the major challenges faced by third parties in the US political landscape?
97-10,In what ways do political parties in the US differ from those in parliamentary systems?
838-1,What are the key factors that influence relationship dynamics?
838-2,How does social media impact relationship dynamics?
838-3,What are the common challenges faced in long-distance relationships?
838-4,What strategies can improve communication in relationships?
838-5,How can couples maintain stability in their relationships?
838-6,What role do leisure activities play in strengthening relationships?
838-7,How can competency in certain skills enhance relationship satisfaction?
838-8,In what ways can image enhancement address social devaluation in relationships?
838-9,What are the psychological effects of social devaluation on relationships?
838-10,What are effective conflict resolution techniques for couples?
