qid,query
464-1,What are the various definitions of 'community' in different academic and social contexts?
464-2,How is a 'civilized community' defined and what characteristics distinguish it from other types of communities?
464-3,What are grassroots organizations and how do they contribute to community development?
464-4,How do communities establish their boundaries and what factors influence these decisions?
464-5,What priorities do communities set for themselves and how are these priorities determined?
464-6,What roles do communities play in disaster preparedness and response?
464-7,How do communities contribute to nation-building and what are the key elements of this process?
464-8,"What are the social, economic, and political factors that influence the formation and sustainability of communities?"
464-9,How do cultural and historical contexts shape the concept of community in different societies?
464-10,What are the challenges faced by communities in maintaining cohesion and identity?
200-1,What were the key events and policies that led to the Holocaust?
200-2,Who were the main perpetrators and leaders responsible for the Holocaust?
200-3,What were the methods and processes used in the execution of the Holocaust?
200-4,What was the experience of European Jewry during the Holocaust?
200-5,What were the immediate and long-term effects of the Holocaust on European Jewry?
200-6,How did the Holocaust influence post-war European society and politics?
200-7,What are the historical parallels between the Holocaust and other destructive events like Sodom and Gomorrah?
200-8,What were the responses of the international community during and after the Holocaust?
200-9,How has the Holocaust been memorialized and remembered in contemporary society?
200-10,What lessons can be learned from the Holocaust to prevent future genocides?
31-1,What are the environmental impacts of e-waste disposal?
31-2,What health risks are associated with improper e-waste management?
31-3,How does improper waste management affect local communities?
31-4,What are the benefits of proper recycling for sustainability?
31-5,How does recycling contribute to local economies?
31-6,What recent innovations in recycling technology have emerged?
31-7,What practical steps can individuals take for responsible waste handling?
31-8,What practical steps can businesses take for responsible waste management?
31-9,What are the global regulations regarding e-waste management?
31-10,What are the common methods of e-waste recycling?
2-1,What are the primary human activities contributing to climate change?
2-2,What natural processes contribute to climate change?
2-3,What are the main greenhouse gases and their sources?
2-4,How does climate change affect human health?
2-5,What are the environmental impacts of global warming?
2-6,How does climate change affect the global economy?
2-7,What evidence exists to support the impacts of climate change?
2-8,What are the global governmental responses to climate change?
2-9,What international agreements have been made to combat climate change?
2-10,What potential solutions exist to mitigate climate change?
2-11,How do climate change and global warming differ?
2-12,What role does deforestation play in climate change?
2-13,How do renewable energy sources contribute to reducing climate change?
2-14,What are the long-term projections for climate change if current trends continue?
2-15,How do climate change impacts vary by region?
233-1,What are the positive effects of social media on the mental health of teenagers?
233-2,What are the negative effects of social media on the mental health of teenagers?
233-3,How does social media usage correlate with depression rates among teenagers?
233-4,What specific features of social media contribute to feelings of depression in teenagers?
233-5,What role does social comparison on social media play in affecting teenagers' mental health?
233-6,How do different types of social media platforms impact teenagers' mental health differently?
233-7,What are the coping mechanisms teenagers use to deal with negative social media experiences?
233-8,How can social media be used positively to promote mental health awareness among teenagers?
233-9,What demographic factors influence the impact of social media on teenagers' mental health?
233-10,What interventions can be implemented to mitigate the negative effects of social media on teenagers' mental health?
58-1,What are the advantages of nuclear energy?
58-2,What are the disadvantages of nuclear energy?
58-3,What safety measures are in place for nuclear energy production?
58-4,"What are the historical accident risks associated with nuclear energy, specifically regarding Chernobyl?"
58-5,How is nuclear energy used in various sectors?
58-6,What is the impact of nuclear energy on climate change?
58-7,How does nuclear energy compare to fusion energy?
58-8,What is bison energy and how does it relate to nuclear energy?
58-9,What is Peninsula Clean Energy and how does it compare to nuclear energy?
499-1,What are the main arguments in favor of legalizing euthanasia?
499-2,What are the main arguments against legalizing euthanasia?
499-3,How does euthanasia differ from physician-assisted suicide?
499-4,What cultural values influence the debate on euthanasia in Western countries?
499-5,How do different Western countries approach the legalization of euthanasia?
499-6,What are the moral justifications for euthanasia from proponents?
499-7,What are the moral justifications against euthanasia from opponents?
499-8,How do religious beliefs impact the views on euthanasia in Western societies?
499-9,What role does public opinion play in the legalization of euthanasia in Western countries?
499-10,What are the potential consequences of legalizing euthanasia on healthcare practices?
161-1,What are the main arguments for and against abortion?
161-2,What psychological and sociological factors contribute to differing views on abortion?
161-3,How have historical events influenced abortion rights in different countries?
161-4,"What role do religious beliefs, such as the Rapture, play in shaping opinions on abortion?"
161-5,How do political ideologies affect people's views on abortion?
161-6,What are the current laws regarding abortion in various countries or states?
161-7,"What is the abortion pill, and how does it work?"
161-8,What are the current priorities of women's rights groups regarding abortion?
161-9,How do cultural attitudes towards abortion vary across different societies?
161-10,What are the implications of recent changes in abortion laws on women's health and rights?
300-1,What are the most effective strategies for preventing global warming?
300-2,What specific actions can be taken to reduce climate change in Antarctica?
300-3,What global measures can be implemented to combat climate change?
300-4,How do economic costs of addressing global warming compare to the costs of its impacts?
300-5,What role do renewable energy sources play in reducing global warming?
300-6,What are the impacts of deforestation on climate change and how can it be mitigated?
300-7,How can international cooperation enhance efforts to prevent climate change?
300-8,What are the potential benefits of implementing carbon pricing?
300-9,What technological innovations are being developed to combat climate change?
300-10,How do climate change policies vary across different countries?
66-1,What are the key principles of utilitarianism and how do they apply to decision-making in organizations?
66-2,What are the fundamental tenets of Kantianism and its implications for leadership in professional settings?
66-3,How do professional codes of ethics in social work influence decision-making processes?
66-4,In what ways do ethical standards shape hiring practices in educational institutions?
66-5,How do ethical theories influence leadership styles in the field of teaching?
66-6,What role do ethical standards play in personal behavior among professionals in social work?
66-7,Why do individuals with strong ethical beliefs sometimes make unethical choices in their professional lives?
66-8,How do utilitarian and Kantian ethical frameworks differ in their approach to leadership decision-making?
66-9,What are the challenges faced by leaders in adhering to ethical standards in organizations?
66-10,How can organizations foster an ethical culture that aligns with both utilitarian and Kantian principles?
93-1,What are the key amendments in the U.S. Constitution and the Bill of Rights that safeguard individual civil liberties?
93-2,How does the Fourth Amendment protect individual rights against unreasonable searches and seizures?
93-3,What protections does the Second Amendment provide regarding the right to bear arms?
93-4,How has the Supreme Court interpreted the Fourth Amendment in relation to individual civil liberties?
93-5,What landmark Supreme Court cases have influenced the interpretation of the Second Amendment?
93-6,In what ways do national security issues impact the interpretation of civil liberties under the Constitution?
93-7,How does the Patriot Act affect individual rights as outlined in the Bill of Rights?
93-8,What are the criticisms of the Patriot Act in relation to civil liberties?
93-9,How do recent Supreme Court rulings address the balance between national security and individual rights?
93-10,What role does public opinion play in shaping the Supreme Court's decisions on civil liberties?
72-1,What are the main environmental impacts of deforestation?
72-2,How does deforestation contribute to climate change?
72-3,What effects does deforestation have on animal species and biodiversity?
72-4,How does deforestation affect human populations and communities?
72-5,What are the primary causes of deforestation?
72-6,What specific effects does deforestation have on the Amazon rainforest?
72-7,What actions and strategies can be implemented to prevent deforestation?
14-1,What are the historical trends in athlete compensation across different sports?
14-2,How does athlete compensation vary between male and female athletes?
14-3,What role does inclusion play in sports participation and viewership?
14-4,How do cultural influences shape the popularity of specific sports in different regions?
14-5,What are the economic impacts of major sporting events on local communities?
14-6,How has the evolution of sports equipment affected athlete performance and safety?
14-7,What are the latest trends in training methodologies for athletes?
14-8,How does athlete mindset and mental health influence performance in sports?
14-9,What factors contribute to the growing popularity of niche sports?
14-10,How do sponsorships and endorsements impact athlete income and sport visibility?
502-1,What are the generative capabilities of artificial intelligence and how are they being applied in various industries?
502-2,How is artificial intelligence impacting the workforce in different sectors?
502-3,What are the benefits of artificial intelligence in education?
502-4,What are the potential risks associated with the use of artificial intelligence in education?
502-5,"How is artificial intelligence being utilized in the arts, and what are its implications?"
502-6,What are the ethical considerations surrounding the use of artificial intelligence in creative fields?
502-7,How are different sectors preparing for the integration of artificial intelligence technologies?
502-8,What are the long-term societal impacts of artificial intelligence on daily life?
502-9,What measures can be taken to mitigate the risks posed by artificial intelligence in various sectors?
502-10,How do different demographics perceive the benefits and risks of artificial intelligence?
24-1,What are the key characteristics of different healthcare systems around the world?
24-2,What factors influence the accessibility of healthcare services in various countries?
24-3,How do costs of healthcare vary between different healthcare systems?
24-4,What are the arguments for and against viewing healthcare as a right versus a privilege?
24-5,What are the main factors affecting healthcare delivery in different systems?
24-6,How does equity in healthcare impact health outcomes for different populations?
24-7,What are the primary expenses associated with healthcare delivery?
24-8,What strategies can be implemented to improve health outcomes for underserved populations?
24-9,How do social determinants of health affect healthcare accessibility and equity?
24-10,What role does government policy play in shaping healthcare systems and their effectiveness?
606-1,What are the current trending topics related to Rangers and Celtic football matches today?
606-2,What specific events or incidents are causing Rangers and Celtic matches to trend today?
606-3,How do social media platforms reflect the popularity of Rangers and Celtic matches today?
606-4,What are the latest scores from today's football matches involving Rangers and Celtic?
606-5,What factors contribute to the significant attention around today's football scores?
606-6,Are there any notable player performances in today's matches involving Rangers and Celtic?
606-7,What historical context exists for the rivalry between Rangers and Celtic that might influence today's trends?
606-8,What are the implications of today's match results for the league standings of Rangers and Celtic?
388-1,What are the main components of the tax system and how do they operate?
388-2,What are the different types of taxes and what are the reasons for their existence?
388-3,How do taxes affect the economy at both macro and micro levels?
388-4,What are the social implications of the tax system?
388-5,What are the processes and implications of switching tax regimes?
388-6,How do tax rates and regulations differ from state to state?
388-7,What are the arguments for and against the fairness of the current tax system?
388-8,How is wealth taxed differently compared to other income types?
388-9,What are the historical changes in the tax system and their impacts?
388-10,What are the common misconceptions about the tax system?
221-1,What are the key characteristics of successful businesses?
221-2,What roles do managers play in the success of a business?
221-3,How do entrepreneurs contribute to business success?
221-4,What strategies can businesses use to minimize risks?
221-5,How can businesses effectively reduce costs without sacrificing quality?
221-6,What is the importance of quality control in business operations?
221-7,How does employee empowerment impact business performance?
221-8,What are the effects of micromanagement on employee motivation and performance?
221-9,How does strategic management influence business success?
221-10,What is the role of stewardship in enhancing business performance?
221-11,How do management styles affect workplace motivation?
360-1,What were the key internal political issues that contributed to the fall of the Western Roman Empire?
360-2,How did social problems within the Western Roman Empire affect its stability and contribute to its collapse?
360-3,What role did economic decline play in the fall of the Western Roman Empire?
360-4,How did barbarian migrations impact the Western Roman Empire during its decline?
360-5,What were the effects of Rome's expansion on its ability to maintain control over its territories?
360-6,What were the military challenges faced by the Western Roman Empire in the years leading up to its fall?
360-7,How did leadership changes and succession crises contribute to the instability of the Western Roman Empire?
360-8,"What were the cultural and religious shifts in the Western Roman Empire, and how did they influence its decline?"
360-9,How did the relationship between the Western Roman Empire and its provinces evolve during its decline?
360-10,What were the long-term consequences of the fall of the Western Roman Empire on Europe?
49-1,"What were the main social, economic, and political causes of the American Civil War?"
49-2,What key events led to the outbreak of the American Civil War?
49-3,What were the major battles and turning points during the American Civil War?
49-4,What were the objectives of the Union during the American Civil War?
49-5,What were the objectives of the Confederacy during the American Civil War?
49-6,"What roles did different types of soldiers (e.g., infantry, cavalry, artillery) play in the American Civil War?"
49-7,How did the American Civil War affect the social structure of the United States?
49-8,What were the economic impacts of the American Civil War on the North and South?
49-9,What were the long-term consequences of the American Civil War on American society?
49-10,How did the American Civil War influence future military strategies and tactics?
